11:37:46.233191 IP 192.168.56.101.ssh > 192.168.56.1.49189: Flags [P.], seq 3923539603:3923539719, ack 1760433417, win 254, length 116
11:37:46.234972 IP 192.168.56.101.ssh > 192.168.56.1.49189: Flags [P.], seq 116:168, ack 1, win 254, length 52
11:37:46.235231 IP 192.168.56.101.ssh > 192.168.56.1.49189: Flags [P.], seq 168:284, ack 1, win 254, length 116
11:37:46.235689 IP 192.168.56.1.49189 > 192.168.56.101.ssh: Flags [.], ack 116, win 252, length 0
11:37:46.235716 IP 192.168.56.1.49189 > 192.168.56.101.ssh: Flags [.], ack 284, win 251, length 0
11:37:46.235828 IP 192.168.56.101.ssh > 192.168.56.1.49189: Flags [P.], seq 284:336, ack 1, win 254, length 52
11:37:46.435799 IP 192.168.56.1.49189 > 192.168.56.101.ssh: Flags [.], ack 336, win 251, length 0
11:38:18.619949 IP 192.168.56.1.49202 > 192.168.56.101.ssh: Flags [S], seq 3098378410, win 8192, options [mss 1460,nop,wscale 8,nop,nop,sackOK], length 0
11:38:18.619986 IP 192.168.56.101.ssh > 192.168.56.1.49202: Flags [S.], seq 1202867861, ack 3098378411, win 29200, options [mss 1460,nop,nop,sackOK,nop,wscale 7], length 0
11:38:18.620254 IP 192.168.56.1.49202 > 192.168.56.101.ssh: Flags [.], ack 1, win 256, length 0
11:38:18.628615 IP 192.168.56.101.ssh > 192.168.56.1.49202: Flags [P.], seq 1:42, ack 1, win 229, length 41
11:38:18.643699 IP 192.168.56.1.49202 > 192.168.56.101.ssh: Flags [P.], seq 1:50, ack 42, win 256, length 49
11:38:18.643836 IP 192.168.56.101.ssh > 192.168.56.1.49202: Flags [.], ack 50, win 229, length 0
11:38:18.644990 IP 192.168.56.1.49202 > 192.168.56.101.ssh: Flags [P.], seq 50:850, ack 42, win 256, length 800
11:38:18.645013 IP 192.168.56.101.ssh > 192.168.56.1.49202: Flags [.], ack 850, win 241, length 0
11:38:18.645164 IP 192.168.56.101.ssh > 192.168.56.1.49202: Flags [.], seq 42:1502, ack 850, win 241, length 1460
11:38:18.645259 IP 192.168.56.101.ssh > 192.168.56.1.49202: Flags [P.], seq 1502:1690, ack 850, win 241, length 188
11:38:18.645365 IP 192.168.56.1.49202 > 192.168.56.101.ssh: Flags [.], ack 1690, win 256, length 0
11:38:18.948152 IP 192.168.56.1.49202 > 192.168.56.101.ssh: Flags [P.], seq 850:1122, ack 1690, win 256, length 272
11:38:18.951801 IP 192.168.56.101.ssh > 192.168.56.1.49202: Flags [P.], seq 1690:2538, ack 1122, win 254, length 848
11:38:18.975665 IP 192.168.56.1.49202 > 192.168.56.101.ssh: Flags [P.], seq 1122:1138, ack 2538, win 253, length 16
11:38:19.014153 IP 192.168.56.101.ssh > 192.168.56.1.49202: Flags [.], ack 1138, win 254, length 0
11:38:19.014596 IP 192.168.56.1.49202 > 192.168.56.101.ssh: Flags [P.], seq 1138:1190, ack 2538, win 253, length 52
11:38:19.014628 IP 192.168.56.101.ssh > 192.168.56.1.49202: Flags [.], ack 1190, win 254, length 0
11:38:19.015046 IP 192.168.56.101.ssh > 192.168.56.1.49202: Flags [P.], seq 2538:2590, ack 1190, win 254, length 52
11:38:19.016106 IP 192.168.56.1.49202 > 192.168.56.101.ssh: Flags [P.], seq 1190:1258, ack 2590, win 253, length 68
11:38:19.019080 IP 192.168.56.101.ssh > 192.168.56.1.49202: Flags [P.], seq 2590:2658, ack 1258, win 254, length 68
11:38:19.022402 IP 192.168.56.1.49202 > 192.168.56.101.ssh: Flags [P.], seq 1258:1342, ack 2658, win 252, length 84
11:38:19.046625 IP 192.168.56.101.ssh > 192.168.56.1.49202: Flags [P.], seq 2658:2694, ack 1342, win 254, length 36
11:38:19.047452 IP 192.168.56.1.49202 > 192.168.56.101.ssh: Flags [P.], seq 1342:1410, ack 2694, win 252, length 68
11:38:19.085914 IP 192.168.56.101.ssh > 192.168.56.1.49202: Flags [.], ack 1410, win 254, length 0
11:38:19.346014 IP 192.168.56.101.ssh > 192.168.56.1.49202: Flags [P.], seq 2694:2746, ack 1410, win 254, length 52
11:38:19.346329 IP 192.168.56.1.49202 > 192.168.56.101.ssh: Flags [P.], seq 1410:1510, ack 2746, win 252, length 100
11:38:19.346346 IP 192.168.56.101.ssh > 192.168.56.1.49202: Flags [.], ack 1510, win 254, length 0
11:38:19.346958 IP 192.168.56.1.49202 > 192.168.56.101.ssh: Flags [P.], seq 1510:1562, ack 2746, win 252, length 52
11:38:19.346969 IP 192.168.56.101.ssh > 192.168.56.1.49202: Flags [.], ack 1562, win 254, length 0
11:38:19.347568 IP 192.168.56.101.ssh > 192.168.56.1.49202: Flags [P.], seq 2746:2798, ack 1562, win 254, length 52
11:38:19.352977 IP 192.168.56.101.ssh > 192.168.56.1.49202: Flags [P.], seq 2798:3426, ack 1562, win 254, length 628
11:38:19.353526 IP 192.168.56.1.49202 > 192.168.56.101.ssh: Flags [.], ack 3426, win 256, length 0
11:38:19.418105 IP 192.168.56.101.ssh > 192.168.56.1.49202: Flags [P.], seq 3426:3510, ack 1562, win 254, length 84
11:38:19.616348 IP 192.168.56.1.49202 > 192.168.56.101.ssh: Flags [.], ack 3510, win 256, length 0
11:38:21.769961 IP 192.168.56.1.49203 > 192.168.56.101.ssh: Flags [S], seq 1893474947, win 8192, options [mss 1460,nop,wscale 8,nop,nop,sackOK], length 0
11:38:21.769998 IP 192.168.56.101.ssh > 192.168.56.1.49203: Flags [S.], seq 1403451395, ack 1893474948, win 29200, options [mss 1460,nop,nop,sackOK,nop,wscale 7], length 0
11:38:21.770298 IP 192.168.56.1.49203 > 192.168.56.101.ssh: Flags [.], ack 1, win 256, length 0
11:38:21.778362 IP 192.168.56.101.ssh > 192.168.56.1.49203: Flags [P.], seq 1:42, ack 1, win 229, length 41
11:38:21.784546 IP 192.168.56.1.49203 > 192.168.56.101.ssh: Flags [P.], seq 1:50, ack 42, win 256, length 49
11:38:21.784620 IP 192.168.56.101.ssh > 192.168.56.1.49203: Flags [.], ack 50, win 229, length 0
11:38:21.785320 IP 192.168.56.101.ssh > 192.168.56.1.49203: Flags [.], seq 42:1502, ack 50, win 229, length 1460
11:38:21.785385 IP 192.168.56.1.49203 > 192.168.56.101.ssh: Flags [P.], seq 50:850, ack 42, win 256, length 800
11:38:21.785424 IP 192.168.56.101.ssh > 192.168.56.1.49203: Flags [P.], seq 1502:1690, ack 50, win 229, length 188
11:38:21.785554 IP 192.168.56.1.49203 > 192.168.56.101.ssh: Flags [.], ack 1690, win 256, length 0
11:38:21.825458 IP 192.168.56.101.ssh > 192.168.56.1.49203: Flags [.], ack 850, win 241, length 0
11:38:22.094089 IP 192.168.56.1.49203 > 192.168.56.101.ssh: Flags [P.], seq 850:1122, ack 1690, win 256, length 272
11:38:22.094119 IP 192.168.56.101.ssh > 192.168.56.1.49203: Flags [.], ack 1122, win 254, length 0
11:38:22.098448 IP 192.168.56.101.ssh > 192.168.56.1.49203: Flags [P.], seq 1690:2538, ack 1122, win 254, length 848
11:38:22.122928 IP 192.168.56.1.49203 > 192.168.56.101.ssh: Flags [P.], seq 1122:1138, ack 2538, win 253, length 16
11:38:22.161991 IP 192.168.56.101.ssh > 192.168.56.1.49203: Flags [.], ack 1138, win 254, length 0
11:38:22.162296 IP 192.168.56.1.49203 > 192.168.56.101.ssh: Flags [P.], seq 1138:1190, ack 2538, win 253, length 52
11:38:22.162318 IP 192.168.56.101.ssh > 192.168.56.1.49203: Flags [.], ack 1190, win 254, length 0
11:38:22.162620 IP 192.168.56.101.ssh > 192.168.56.1.49203: Flags [P.], seq 2538:2590, ack 1190, win 254, length 52
11:38:22.163416 IP 192.168.56.1.49203 > 192.168.56.101.ssh: Flags [P.], seq 1190:1258, ack 2590, win 253, length 68
11:38:22.166907 IP 192.168.56.101.ssh > 192.168.56.1.49203: Flags [P.], seq 2590:2658, ack 1258, win 254, length 68
11:38:22.167919 IP 192.168.56.1.49203 > 192.168.56.101.ssh: Flags [P.], seq 1258:1342, ack 2658, win 252, length 84
11:38:22.196575 IP 192.168.56.101.ssh > 192.168.56.1.49203: Flags [P.], seq 2658:2694, ack 1342, win 254, length 36
11:38:22.197338 IP 192.168.56.1.49203 > 192.168.56.101.ssh: Flags [P.], seq 1342:1410, ack 2694, win 252, length 68
11:38:22.233798 IP 192.168.56.101.ssh > 192.168.56.1.49203: Flags [.], ack 1410, win 254, length 0
11:38:22.477502 IP 192.168.56.101.ssh > 192.168.56.1.49203: Flags [P.], seq 2694:2746, ack 1410, win 254, length 52
11:38:22.477926 IP 192.168.56.1.49203 > 192.168.56.101.ssh: Flags [P.], seq 1410:1510, ack 2746, win 252, length 100
11:38:22.477941 IP 192.168.56.101.ssh > 192.168.56.1.49203: Flags [.], ack 1510, win 254, length 0
11:38:22.478325 IP 192.168.56.1.49203 > 192.168.56.101.ssh: Flags [P.], seq 1510:1562, ack 2746, win 252, length 52
11:38:22.478334 IP 192.168.56.101.ssh > 192.168.56.1.49203: Flags [.], ack 1562, win 254, length 0
11:38:22.479077 IP 192.168.56.101.ssh > 192.168.56.1.49203: Flags [P.], seq 2746:2798, ack 1562, win 254, length 52
11:38:22.484546 IP 192.168.56.101.ssh > 192.168.56.1.49203: Flags [P.], seq 2798:3426, ack 1562, win 254, length 628
11:38:22.485242 IP 192.168.56.1.49203 > 192.168.56.101.ssh: Flags [.], ack 3426, win 256, length 0
11:38:22.548012 IP 192.168.56.101.ssh > 192.168.56.1.49203: Flags [P.], seq 3426:3510, ack 1562, win 254, length 84
11:38:22.747592 IP 192.168.56.1.49203 > 192.168.56.101.ssh: Flags [.], ack 3510, win 256, length 0
11:38:26.196627 IP 192.168.56.1.49202 > 192.168.56.101.ssh: Flags [P.], seq 1562:1614, ack 3510, win 256, length 52
11:38:26.197318 IP 192.168.56.101.ssh > 192.168.56.1.49202: Flags [P.], seq 3510:3562, ack 1614, win 254, length 52
11:38:26.350018 IP 192.168.56.1.49202 > 192.168.56.101.ssh: Flags [P.], seq 1614:1666, ack 3562, win 256, length 52
11:38:26.350604 IP 192.168.56.101.ssh > 192.168.56.1.49202: Flags [P.], seq 3562:3614, ack 1666, win 254, length 52
11:38:26.452432 IP 192.168.56.1.49202 > 192.168.56.101.ssh: Flags [P.], seq 1666:1718, ack 3614, win 255, length 52
11:38:26.453146 IP 192.168.56.101.ssh > 192.168.56.1.49202: Flags [P.], seq 3614:3666, ack 1718, win 254, length 52
11:38:26.524911 IP 192.168.56.1.49202 > 192.168.56.101.ssh: Flags [P.], seq 1718:1770, ack 3666, win 255, length 52
11:38:26.525495 IP 192.168.56.101.ssh > 192.168.56.1.49202: Flags [P.], seq 3666:3718, ack 1770, win 254, length 52
11:38:26.727616 IP 192.168.56.1.49202 > 192.168.56.101.ssh: Flags [.], ack 3718, win 255, length 0
11:38:26.758197 IP 192.168.56.1.49202 > 192.168.56.101.ssh: Flags [P.], seq 1770:1822, ack 3718, win 255, length 52
11:38:26.758918 IP 192.168.56.101.ssh > 192.168.56.1.49202: Flags [P.], seq 3718:3770, ack 1822, win 254, length 52
11:38:26.957641 IP 192.168.56.1.49202 > 192.168.56.101.ssh: Flags [.], ack 3770, win 255, length 0
11:38:26.971550 IP 192.168.56.1.49202 > 192.168.56.101.ssh: Flags [P.], seq 1822:1874, ack 3770, win 255, length 52
11:38:26.978144 IP 192.168.56.101.ssh > 192.168.56.1.49202: Flags [P.], seq 3770:3822, ack 1874, win 254, length 52
11:38:26.981222 IP 192.168.56.101.ssh > 192.168.56.1.49202: Flags [P.], seq 3822:3874, ack 1874, win 254, length 52
11:38:26.981750 IP 192.168.56.1.49202 > 192.168.56.101.ssh: Flags [.], ack 3874, win 254, length 0
11:38:26.982283 IP 192.168.56.101.ssh > 192.168.56.1.49202: Flags [P.], seq 3874:3926, ack 1874, win 254, length 52
11:38:26.986020 IP 192.168.56.101.ssh > 192.168.56.1.49202: Flags [P.], seq 3926:4026, ack 1874, win 254, length 100
11:38:26.987121 IP 192.168.56.101.ssh > 192.168.56.1.49202: Flags [P.], seq 4026:4078, ack 1874, win 254, length 52
11:38:26.987506 IP 192.168.56.101.ssh > 192.168.56.1.49202: Flags [P.], seq 4078:4194, ack 1874, win 254, length 116
11:38:26.987739 IP 192.168.56.101.ssh > 192.168.56.1.49202: Flags [P.], seq 4194:4246, ack 1874, win 254, length 52
11:38:26.988046 IP 192.168.56.101.ssh > 192.168.56.1.49202: Flags [P.], seq 4246:4362, ack 1874, win 254, length 116
11:38:26.988276 IP 192.168.56.101.ssh > 192.168.56.1.49202: Flags [P.], seq 4362:4414, ack 1874, win 254, length 52
11:38:26.989071 IP 192.168.56.101.ssh > 192.168.56.1.49202: Flags [P.], seq 4414:4514, ack 1874, win 254, length 100
11:38:26.989501 IP 192.168.56.101.ssh > 192.168.56.1.49202: Flags [P.], seq 4514:4566, ack 1874, win 254, length 52
11:38:26.990367 IP 192.168.56.101.ssh > 192.168.56.1.49202: Flags [P.], seq 4566:4650, ack 1874, win 254, length 84
11:38:26.991329 IP 192.168.56.1.49202 > 192.168.56.101.ssh: Flags [.], ack 4026, win 254, length 0
11:38:26.991349 IP 192.168.56.1.49202 > 192.168.56.101.ssh: Flags [.], ack 4194, win 253, length 0
11:38:26.991355 IP 192.168.56.1.49202 > 192.168.56.101.ssh: Flags [.], ack 4362, win 252, length 0
11:38:26.991359 IP 192.168.56.1.49202 > 192.168.56.101.ssh: Flags [.], ack 4514, win 252, length 0
11:38:26.991362 IP 192.168.56.1.49202 > 192.168.56.101.ssh: Flags [.], ack 4650, win 251, length 0
11:38:29.338811 IP 192.168.56.1.49203 > 192.168.56.101.ssh: Flags [P.], seq 1562:1614, ack 3510, win 256, length 52
11:38:29.339675 IP 192.168.56.101.ssh > 192.168.56.1.49203: Flags [P.], seq 3510:3562, ack 1614, win 254, length 52
11:38:29.490347 IP 192.168.56.1.49203 > 192.168.56.101.ssh: Flags [P.], seq 1614:1666, ack 3562, win 256, length 52
11:38:29.491899 IP 192.168.56.101.ssh > 192.168.56.1.49203: Flags [P.], seq 3562:3614, ack 1666, win 254, length 52
11:38:29.520858 IP 192.168.56.1.49203 > 192.168.56.101.ssh: Flags [P.], seq 1666:1718, ack 3614, win 255, length 52
11:38:29.521547 IP 192.168.56.101.ssh > 192.168.56.1.49203: Flags [P.], seq 3614:3666, ack 1718, win 254, length 52
11:38:29.644172 IP 192.168.56.1.49203 > 192.168.56.101.ssh: Flags [P.], seq 1718:1770, ack 3666, win 255, length 52
11:38:29.644744 IP 192.168.56.101.ssh > 192.168.56.1.49203: Flags [P.], seq 3666:3718, ack 1770, win 254, length 52
11:38:29.820361 IP 192.168.56.1.49203 > 192.168.56.101.ssh: Flags [P.], seq 1770:1822, ack 3718, win 255, length 52
11:38:29.821880 IP 192.168.56.101.ssh > 192.168.56.1.49203: Flags [P.], seq 3718:3770, ack 1822, win 254, length 52
11:38:30.019021 IP 192.168.56.1.49203 > 192.168.56.101.ssh: Flags [.], ack 3770, win 255, length 0
11:38:30.485311 IP 192.168.56.1.49203 > 192.168.56.101.ssh: Flags [P.], seq 1822:1874, ack 3770, win 255, length 52
11:38:30.490043 IP 192.168.56.101.ssh > 192.168.56.1.49203: Flags [P.], seq 3770:3822, ack 1874, win 254, length 52
11:38:30.492920 IP 192.168.56.101.ssh > 192.168.56.1.49203: Flags [P.], seq 3822:3874, ack 1874, win 254, length 52
11:38:30.494817 IP 192.168.56.101.ssh > 192.168.56.1.49203: Flags [P.], seq 3874:3926, ack 1874, win 254, length 52
11:38:30.494880 IP 192.168.56.1.49203 > 192.168.56.101.ssh: Flags [.], ack 3874, win 254, length 0
11:38:30.495682 IP 192.168.56.101.ssh > 192.168.56.1.49203: Flags [P.], seq 3926:4026, ack 1874, win 254, length 100
11:38:30.495960 IP 192.168.56.101.ssh > 192.168.56.1.49203: Flags [P.], seq 4026:4078, ack 1874, win 254, length 52
11:38:30.496636 IP 192.168.56.1.49203 > 192.168.56.101.ssh: Flags [.], ack 4026, win 254, length 0
11:38:30.496891 IP 192.168.56.101.ssh > 192.168.56.1.49203: Flags [P.], seq 4078:4194, ack 1874, win 254, length 116
11:38:30.497495 IP 192.168.56.1.49203 > 192.168.56.101.ssh: Flags [.], ack 4194, win 253, length 0
11:38:30.498179 IP 192.168.56.101.ssh > 192.168.56.1.49203: Flags [P.], seq 4194:4246, ack 1874, win 254, length 52
11:38:30.498699 IP 192.168.56.101.ssh > 192.168.56.1.49203: Flags [P.], seq 4246:4362, ack 1874, win 254, length 116
11:38:30.499010 IP 192.168.56.101.ssh > 192.168.56.1.49203: Flags [P.], seq 4362:4414, ack 1874, win 254, length 52
11:38:30.499665 IP 192.168.56.1.49203 > 192.168.56.101.ssh: Flags [.], ack 4362, win 252, length 0
11:38:30.500034 IP 192.168.56.101.ssh > 192.168.56.1.49203: Flags [P.], seq 4414:4514, ack 1874, win 254, length 100
11:38:30.500553 IP 192.168.56.1.49203 > 192.168.56.101.ssh: Flags [.], ack 4514, win 252, length 0
11:38:30.500916 IP 192.168.56.101.ssh > 192.168.56.1.49203: Flags [P.], seq 4514:4566, ack 1874, win 254, length 52
11:38:30.504524 IP 192.168.56.101.ssh > 192.168.56.1.49203: Flags [P.], seq 4566:4650, ack 1874, win 254, length 84
11:38:30.504995 IP 192.168.56.1.49203 > 192.168.56.101.ssh: Flags [.], ack 4650, win 251, length 0
11:38:30.814346 IP 192.168.56.1.49189 > 192.168.56.101.ssh: Flags [P.], seq 1:37, ack 336, win 251, length 36
11:38:30.853943 IP 192.168.56.101.ssh > 192.168.56.1.49189: Flags [.], ack 37, win 254, length 0
11:38:30.910480 IP 192.168.56.1.49203 > 192.168.56.101.ssh: Flags [P.], seq 1874:1926, ack 4650, win 251, length 52
11:38:30.911944 IP 192.168.56.101.ssh > 192.168.56.1.49203: Flags [P.], seq 4650:4702, ack 1926, win 254, length 52
11:38:31.026545 IP 192.168.56.1.49203 > 192.168.56.101.ssh: Flags [P.], seq 1926:1978, ack 4702, win 251, length 52
11:38:31.027120 IP 192.168.56.101.ssh > 192.168.56.1.49203: Flags [P.], seq 4702:4754, ack 1978, win 254, length 52
11:38:31.098373 IP 192.168.56.1.49203 > 192.168.56.101.ssh: Flags [P.], seq 1978:2030, ack 4754, win 251, length 52
11:38:31.098985 IP 192.168.56.101.ssh > 192.168.56.1.49203: Flags [P.], seq 4754:4806, ack 2030, win 254, length 52
11:38:31.214764 IP 192.168.56.1.49203 > 192.168.56.101.ssh: Flags [P.], seq 2030:2082, ack 4806, win 251, length 52
11:38:31.215289 IP 192.168.56.101.ssh > 192.168.56.1.49203: Flags [P.], seq 4806:4858, ack 2082, win 254, length 52
11:38:31.228083 IP 192.168.56.101.ssh > 192.168.56.1.49203: Flags [P.], seq 4858:4926, ack 2082, win 254, length 68
11:38:31.229069 IP 192.168.56.101.ssh > 192.168.56.1.49203: Flags [P.], seq 4926:4978, ack 2082, win 254, length 52
11:38:31.230609 IP 192.168.56.101.ssh > 192.168.56.1.49203: Flags [P.], seq 4978:5062, ack 2082, win 254, length 84
11:38:31.232014 IP 192.168.56.1.49203 > 192.168.56.101.ssh: Flags [.], ack 4926, win 256, length 0
11:38:31.232069 IP 192.168.56.1.49203 > 192.168.56.101.ssh: Flags [.], ack 5062, win 256, length 0

